{
  "歌曲名": "✞ 像神一样呐 ✞ 神っぽいな 【永雏塔菲直播剪辑喵】",
  "演唱者": "永雏塔菲",
  "歌词片段": "",
  "_source": {
    "bvid": "BV1NP411m72Y",
    "title": "✞像神一样呐✞ 神っぽいな",
    "desc": "楽曲本家 / ピノキオピー様\nhttps://www.nicovideo.jp/watch/sm39334235\n舞蹈本家：BV1oa41127oR\n屏幕PV:\n视频：-目遮遮遮遮遮遮子-\n曲绘：卡带子君",
    "type": "cover"
  },
  "封面": "20230502_BV1NP411m72Y.jpg"
}