{
  "歌曲名": "Override",
  "演唱者": "永雏塔菲",
  "歌词片段": "",
  "_source": {
    "bvid": "BV155KPerE5M",
    "title": "Override Covered by 永雏塔菲",
    "desc": "本家：\nオーバーライド - 重音テトSV[吉田夜世]\nhttps://www.youtube.com/watch?v=LLjfal8jCYI\n\nCover·永雏塔菲\nIllustration·均&永雏砂糖橘\nMix·Pd.46\nVideo&Effect ·猫箱工作室&心情链环",
    "type": "cover"
  },
  "封面": "20250214_BV155KPerE5M.jpg"
}