{
  "歌曲名": "对不起，因为我是活在二次元的女孩（永雏塔菲4周年纪念）",
  "演唱者": "永雏塔菲",
  "歌词片段": "",
  "封面": "20250622_BV1ZoNyzSEay.jpg",
  "_source": {
    "bvid": "BV1ZoNyzSEay",
    "title": "对不起，因为我是活在二次元的女孩（永雏塔菲4周年纪念）",
    "desc": "Cover:永雏塔菲 Mix:Pd.46 PV制作：猫箱工作室/心情链环/一碗腌河粉 伴奏：樱景琳 作曲:43スレ437（となさ） 作词:41スレ673 主催、策划：永雏火机 主美术：黄小黄 场景美术：橘榉 人设：黄小黄/永雏砂糖橘 画师：橘榉/兜风的蛋挞/芽吹风来/钛乐（约稿对接：TEEMSKYL）/ 米其林大秋葵/小篝kagari/森森梩/永雏砂糖橘/永雏觉/大叽饿饿喵/ 永雏小舞/一只冻梨耶耶/黄小黄/果酸子/小浣Racoy/永雏兔兔喵/ 小矮 结尾摄影：秋风星落 中文字幕打轴：萝莉控小夕 伴唱使用：洛天依 友情赞助（排名不分先后，一些雏草姬比较害羞没有写上来）： Rigeeeee/秋风星落/星宫星/永雏小舞/一碗腌河粉/fzlong/ 黑色亚佐夫"
  }
}