{
  "歌曲名": "呜呼、美妙的喵生🐈/嗚呼、素晴らしきニャン生🐾【翻唱PV付】",
  "演唱者": "永雏塔菲",
  "歌词片段": "",
  "_source": {
    "bvid": "BV1nx421y7pG",
    "title": "【永雏塔菲🐱莫小燃】呜呼、美妙的喵生🐈/嗚呼、素晴らしきニャン生🐾",
    "desc": "ytb本家：https://youtu.be/xcNFyPciZ0g?si=sFYfLUKeaIYxTX4K\nNICO本家：sm14990051 \n词·曲：Nem様\nVOCAL：永雏塔菲、@莫小燃ENFP-A  \n曲绘：@あいうAIU  \nMIX：@Pd46  \nMOVIE：@猫箱工作室 ",
    "type": "cover"
  },
  "封面": "20240308_BV1nx421y7pG.jpg"
}