{
  "歌曲名": "永雏塔菲💖可爱的女朋友/キュートなカノジョ✂️",
  "演唱者": "永雏塔菲",
  "歌词片段": "",
  "_source": {
    "bvid": "BV1qe41117Qi",
    "title": "可爱的女朋友/キュートなカノジョ",
    "desc": "本家：BV1E5411N7nP\n曲·syudou\nvocal·永雏塔菲\nMix·Pd.46\nIllust·kea\nPv Template·Rumskii",
    "type": "cover"
  },
  "封面": "20240119_BV1qe41117Qi.jpg"
}