{
  "歌曲名": "无责任集合体（㋰責任集合体）",
  "演唱者": "永雏塔菲",
  "歌词片段": "",
  "_source": {
    "bvid": "BV12yB5YXEEL",
    "title": "无责任集合体/㋰責任集合体",
    "desc": "Music·マサラダ\nCover·永雏塔菲\nIllustration·菠萝\nMeme Reference · みおちん\nMeme Effect · kkmfd\nMix·Pd.46\nVideo&Effect ·心情链环",
    "type": "cover"
  },
  "封面": "20241214_BV12yB5YXEEL.jpg"
}