{
  "歌曲名": "taffy只是糖果曲奇巧克力🍭🍪🍫吃多了🤢",
  "演唱者": "永雏塔菲",
  "歌词片段": "",
  "封面": "20250411_BV1S3dCYSEdL.jpg",
  "_source": {
    "bvid": "BV1S3dCYSEdL",
    "title": "キャンディークッキーチョコレート/糖果曲奇巧克力",
    "desc": "本家：https://youtu.be/bI3542HJRzY 原视频名：キャンディークッキーチョコレート　🍭🍪🍫初音ミク・重音テトSV 原视频作者：はろける・HALLO CEL Cover·永雏塔菲 Music＆Background Movie / はろける Illustration·永雏砂糖橘 Mix·Pd.46 Character Movie 心情链环 歌词中文翻译·苏维埃冰棺中的伊利亚"
  }
}