{
  "歌曲名": "塔菲想当个圣人君子",
  "演唱者": "永雏塔菲",
  "歌词片段": "",
  "封面": "20250831_BV14oaGzyEHE.jpg",
  "_source": {
    "bvid": "BV14oaGzyEHE",
    "title": "塔菲想当个圣人君子",
    "desc": "本家：https://youtu.be/hrBjKBPNi1c 原视频名：聖人君子でありたい / 重音テトSV 原视频作者：しゃいと Cover·永雏塔菲 Illustration·nor Mix·Pd.46 Videot ·心情链环 中译来自·苏维埃冰棺中的伊利亚"
  }
}