{
  "歌曲名": "独立游戏1883op『真実の鍵』",
  "演唱者": "永雏塔菲",
  "歌词片段": "",
  "_source": {
    "bvid": "BV1j14y127GF",
    "title": "【永雏塔菲原创曲】独立游戏1883op『真実の鍵』",
    "desc": "真実の鍵 / 真实之钥\n打破时间的封印，在1883年与你相遇。\n\n作曲：Mrguai/叶秋羽 喵\n编曲：Mrguai/JIAYE 喵\n作词：叶秋羽/いぬごし とうふ 喵\n唱：永雏塔菲 喵\n曲绘：电车喵 喵\n做pv的叫什么职位？：我是小立怎么了 喵\n混音：pd.46 喵\n给歌起名喵：肉喵w 喵\n开头照片素材画师：nor喵\n游戏cg素材画师：均 喵\n封面画师：kita 喵\n封面美工：rinki 喵\n参",
    "type": "original"
  },
  "封面": "20230625_BV1j14y127GF.jpg"
}