{
  "歌曲名": "🐱taffy是你的电子宠物喵🎀キャットラビング / Cat Loving💕",
  "演唱者": "永雏塔菲",
  "歌词片段": "",
  "封面": "20220626_BV1u34y1s77F.jpg",
  "_source": {
    "bvid": "BV1u34y1s77F",
    "title": "キャットラビング/Cat Loving💕-🐱taffy是你的电子宠物喵🎀",
    "desc": "本家：https://youtu.be/7gwvBrlUiww Vocal：永雏塔菲 绘：冬灵、永雏玻璃 Mix：Pd.46 動画：心情链环"
  }
}