{
  "歌曲名": "我还记得第一次被关注的那天，看见我认可我的温暖……（INTERNET YAMERO）",
  "演唱者": "永雏塔菲",
  "歌词片段": "",
  "_source": {
    "bvid": "BV1gWbwz2Edw",
    "title": "INTERNET YAMERO-我还记得第一次被关注的那天，看见我认可我的温暖……",
    "desc": "「INTERNET YAMERO」\ncover永雏塔菲\n编曲/作曲Aiobahn\n词にゃるら\n振付参考@南极煎贝  \n封面@永雏砂糖橘",
    "type": "cover"
  },
  "封面": "20250810_BV1gWbwz2Edw.jpg"
}