{
  "歌曲名": "这次也无法与你结合呢✰即刻轮回",
  "演唱者": "永雏塔菲",
  "歌词片段": "",
  "_source": {
    "bvid": "BV1yvC4BxEZc",
    "title": "这次也无法与你结合呢✰即刻轮回/いますぐ輪廻",
    "desc": "本家：https://youtu.be/3iUgKH8c7p4?list=RD3iUgKH8c7p4\n本家标题：いますぐ輪廻 / 初音ミク\nP主：なきそ\ncover：永雏塔菲\n曲绘：nor\n设计：菠萝（魔法少女、轮回12及207944154部分）、nor（pv中出现的除taffy官方服设的其余部分）\n混音：Pd.46\n视频制作：心情链环\n背景3d模型使用：alex.andain.777、Conso",
    "type": "cover"
  },
  "封面": "20251113_BV1yvC4BxEZc.jpg"
}