{
  "歌曲名": "✟塔菲",
  "演唱者": "永雏塔菲",
  "歌词片段": "",
  "_source": {
    "bvid": "BV1CP4y1q7YA",
    "title": "らくらく安楽死",
    "desc": "Org：らくらく■■■　♪初音ミク/VY1/ぽよろいど\n【https://b23.tv/BV1L14y1A7b6】\nmusic: ぺぽよ\nVocal: Ace Taffy \nIllust: 诺北nor\nMovie: 太儿233\nMix: Pd46 \n参考meme：\n水綿 様【https://youtu.be/OY0emlWbG5g】\nゆい 様【https://youtu.be/q-lWDD3h9J",
    "type": "cover"
  },
  "封面": "20221230_BV1CP4y1q7YA.jpg"
}