{
  "歌曲名": "他们说接受过赞美👍就活该忍受着诋毁👎《虚拟假面🎭》",
  "演唱者": "永雏塔菲",
  "歌词片段": "",
  "_source": {
    "bvid": "BV1vxPXe6EzV",
    "title": "他们说接受过赞美👍就活该忍受着诋毁👎《虚拟假面🎭》",
    "desc": "演唱：永雏塔菲\n作词：周梦忆/路哥/永雏塔菲\n作曲：芋头妈妈/路哥\n编曲：陈林len\n制作人：路哥\n项目统筹/监制/企划：路哥\n统筹助理：陈斯瀚\n鸣谢：山风大王\n混音：Pd.46\n[Video Credits]\nDirection/ Illustration：AIUaiu\nVideo / UI：步楊",
    "type": "original"
  },
  "封面": "20250203_BV1vxPXe6EzV.jpg"
}