{
  "歌曲名": "永雏塔菲",
  "演唱者": "",
  "歌词片段": "",
  "_source": {
    "bvid": "BV1uC411W79a",
    "title": "永雏塔菲原创曲🍀未来旅行🍀（🎉百万粉纪念曲🥳）",
    "desc": "QQ音乐电音联盟/永雏塔菲/HJLL\n编曲：HJLL\n作曲：HJLL\n作词：举个栗子@昭世之月\n人声校准：蔡成钰/Mestie\n监制：魏瞑忆/涣川(fish)\n统筹：涣川(fish)/魏暝忆\n总策划：beson\n出品：QQ音乐电音联盟/留声音乐\n@QQ音乐 ",
    "type": "original"
  },
  "封面": "20240224_BV1uC411W79a.jpg"
}