{
  "歌曲名": "YOASOBI アイドル / 偶像 （我推的孩子OP）【永雏塔菲直播剪辑喵】",
  "演唱者": "永雏塔菲",
  "歌词片段": "",
  "_source": {
    "bvid": "BV1Wk4y1E77N",
    "title": "アイドル/偶像-YOASOBI",
    "desc": "楽曲ご本家：YOASOBI様\n『YOASOBI「アイドル」』BV17h411u7sb\n编舞：まぁり様\nhttps://www.nicovideo.jp/watch/sm42095419\n唱跳/5毛特效：taffy",
    "type": "cover"
  },
  "封面": "20230503_BV1Wk4y1E77N.jpg"
}