{
  "歌曲名": "🦑受到攻击🦑要冲出来了🦑关注塔菲谢谢喵🦑",
  "演唱者": "永雏塔菲",
  "歌词片段": "",
  "封面": "20250704_BV1EF3uzeETo.jpg",
  "_source": {
    "bvid": "BV1EF3uzeETo",
    "title": "🦑受到攻击🦑要冲出来了🦑关注塔菲谢谢喵🦑",
    "desc": "演唱：永雏塔菲 作曲：依溪禾 作词：南羽 编曲：Koiflower@ChillMe 混音：依溪禾 母带：果屋office 和声：Ciyo 监制：一只岁碎 统筹：SoilFo_yuan 制作人：依溪禾 音乐制作：联合麦田 音乐企划：星河碎片Astroluxia [Video Credits]  Direction/ Illustration：AIUaiu  Video：inst-1 步楊 历寒 Lyric design: AIUaiu 森芷"
  }
}