{
  "歌曲名": "我推的平安京偶像与王牌级偶像合唱了「偶像/アイドル」",
  "演唱者": "永雏塔菲",
  "歌词片段": "",
  "_source": {
    "bvid": "BV1tT421Y7P3",
    "title": "我推的平安京偶像与王牌级偶像合唱了「偶像/アイドル」",
    "desc": "和桃花妖一起唱了偶像喵！\n二创动画借物&制作表：\n——Model——\n永雏塔菲（偶像服）\n决战平安京（桃花妖_和都町·绯结)\n——Motion——\nたこはちＰ/紫音美菜/ノン\n——Camera——\n小五\n——Stage——\nPhilippe-n-12\n——Effect——\nRui、ましまし、Elle/データP、そぼろ、ikeno、P.I.P、下っ腹P、おたもん、針金P、hyanu、三金络合物、ビー",
    "type": "cover"
  },
  "封面": "20240706_BV1tT421Y7P3.jpg"
}