{
  "歌曲名": "又一遍的歌",
  "演唱者": "电音联盟/TSAR/永雏塔菲",
  "歌词片段": "",
  "_source": {
    "bvid": "BV1qe411q7KS",
    "title": "【原创曲】又一遍的歌",
    "desc": "词/曲/编曲/混音/母带@TSAR（https://b23.tv/glqgaDq）\n演唱@永雏塔菲（https://b23.tv/vOCwkAD）\n灯光@JW_STAGE_叶鲁锋（https://b23.tv/jbPZFyy）\nPV@kkmfd（https://b23.tv/x5elHHO）\n封面插画@林有一兔（https://b23.tv/wfqT1r4）",
    "type": "original"
  },
  "封面": "20231231_BV1qe411q7KS.jpg"
}