{
  "歌曲名": "强风大背头 / 強風オールバック",
  "演唱者": "永雏塔菲",
  "歌词片段": "",
  "_source": {
    "bvid": "BV1kM4y1j7P7",
    "title": "强风大背头/強風オールバック",
    "desc": "本家：Yukopi - 強風オールバック (feat.歌愛ユキ)\nhttps://youtu.be/D6DVTLvOupE\nMusic & Lyrics : ゆこぴ\n翻唱：永雏塔菲 喵\n混音：pd46 喵\n曲绘/封面：琳Rinki 喵\ntaffy还是不知道做PV的职位叫什么名字反正就是做PV的人是：心情链环 喵\n背景模板:NekoWings",
    "type": "cover"
  },
  "封面": "20230712_BV1kM4y1j7P7.jpg"
}